{
  "$schema": "https://w3id.org/qi-vc/schemas/v1/policy-profile.schema.json",
  "id": "calibration-direct-accreditation",
  "targetCredentialTypes": [
    "DigitalCalibrationCertificate"
  ],
  "requiredEvidence": [
    {
      "id": "direct-accreditation",
      "relation": "authorizedBy",
      "authorizationBasis": {
        "kind": "accreditation"
      },
      "required": true
    }
  ],
  "checks": {
    "proof": "optional",
    "schema": "optional",
    "status": "optional",
    "digest": "required",
    "scopeInclusion": "dccScopeInclusion",
    "derivation": "scopeSubset",
    "cycleDetection": "required",
    "termsOfUse": "optional"
  },
  "limits": {
    "maxDepth": 8,
    "maxEvidenceNodes": 32
  }
}
